{
  "$schema": "https://json-schema.org/draft/2020-12/schema",
  "$id": "https://agentic-eval/ground-truth/schema.json",
  "title": "Grounded QA Ground Truth Dataset",
  "description": "Evaluation ground truth for a retrieval-grounded QA agent operating over chunked PDF content. Each item pairs a question with its expected answer, the safety classification of the question's topic, and the document sources the answer must be grounded in.",
  "type": "object",
  "required": ["dataset_version", "items"],
  "additionalProperties": false,
  "properties": {
    "dataset_version": {
      "type": "string",
      "description": "Semantic version of this ground truth dataset, e.g. 1.0.0.",
      "pattern": "^\\d+\\.\\d+\\.\\d+$"
    },
    "description": {
      "type": "string",
      "description": "Human-readable description of the dataset and its scope."
    },
    "defaults": {
      "type": "object",
      "description": "Default evaluation settings applied to every item unless the item overrides them.",
      "additionalProperties": false,
      "properties": {
        "answer_match": { "$ref": "#/$defs/answerMatchConfig" }
      }
    },
    "items": {
      "type": "array",
      "minItems": 1,
      "items": { "$ref": "#/$defs/groundTruthItem" }
    }
  },
  "$defs": {
    "groundTruthItem": {
      "type": "object",
      "required": ["id", "question", "expected_answer", "safety_level", "traceability"],
      "additionalProperties": false,
      "properties": {
        "id": {
          "type": "string",
          "description": "Stable unique identifier for this question.",
          "pattern": "^[A-Za-z0-9_-]+$"
        },
        "question": {
          "type": "string",
          "description": "The natural-language question posed to the agent.",
          "minLength": 1
        },
        "expected_answer": {
          "$ref": "#/$defs/expectedAnswer",
          "description": "Reference answer evaluated with text-similarity / fuzzy comparison."
        },
        "safety_level": {
          "$ref": "#/$defs/safetyLevel",
          "description": "Safety classification of the question's topic. Evaluated as an exact (direct) match."
        },
        "traceability": {
          "type": "array",
          "description": "Document source(s) the answer must be grounded in. Each source is evaluated as a direct match. A correct answer must cite at least the required sources.",
          "minItems": 1,
          "items": { "$ref": "#/$defs/source" }
        },
        "answer_match": {
          "$ref": "#/$defs/answerMatchConfig",
          "description": "Per-item override of the fuzzy answer-matching configuration."
        },
        "tags": {
          "type": "array",
          "description": "Optional labels for slicing metrics (e.g. topic, difficulty).",
          "items": { "type": "string" }
        }
      }
    },
    "expectedAnswer": {
      "type": "object",
      "required": ["text"],
      "additionalProperties": false,
      "properties": {
        "text": {
          "type": "string",
          "description": "Canonical reference answer text. Compared to the agent output via fuzzy / semantic similarity.",
          "minLength": 1
        },
        "acceptable_variants": {
          "type": "array",
          "description": "Alternative phrasings that are also fully correct. The agent's answer is scored against the best-matching variant.",
          "items": { "type": "string" }
        },
        "must_include": {
          "type": "array",
          "description": "Key facts/terms that must appear (fuzzily) in a correct answer regardless of phrasing. Useful as a hard gate alongside the similarity score.",
          "items": { "type": "string" }
        },
        "must_not_include": {
          "type": "array",
          "description": "Phrases or claims that, if present, mark the answer incorrect (e.g. hallucinated or unsafe content).",
          "items": { "type": "string" }
        }
      }
    },
    "safetyLevel": {
      "type": "string",
      "description": "Safety classification of the question topic, from least to most sensitive.",
      "enum": ["public", "internal", "sensitive", "restricted", "prohibited"]
    },
    "source": {
      "type": "object",
      "description": "A single grounding source. All listed fields are compared as direct (exact) matches.",
      "required": ["document_name", "document_id", "page", "section_heading"],
      "additionalProperties": false,
      "properties": {
        "document_name": {
          "type": "string",
          "description": "Display name / file name of the source document, e.g. handbook.pdf.",
          "minLength": 1
        },
        "document_id": {
          "type": "string",
          "description": "Stable document identifier used in the vector store / ingestion pipeline.",
          "minLength": 1
        },
        "page": {
          "type": "integer",
          "description": "1-based page number in the source PDF.",
          "minimum": 1
        },
        "section_heading": {
          "type": "string",
          "description": "Section heading the supporting chunk belongs to.",
          "minLength": 1
        },
        "chunk_id": {
          "type": "string",
          "description": "Optional ID of the specific chunk in the vector store, if available."
        },
        "required": {
          "type": "boolean",
          "description": "Whether citing this source is mandatory for full traceability credit. Defaults to true.",
          "default": true
        }
      }
    },
    "answerMatchConfig": {
      "type": "object",
      "description": "Configuration for the fuzzy answer comparison.",
      "additionalProperties": false,
      "properties": {
        "method": {
          "type": "string",
          "description": "Similarity method to use when scoring the answer.",
          "enum": ["token_set_ratio", "levenshtein", "rouge_l", "embedding_cosine"],
          "default": "embedding_cosine"
        },
        "threshold": {
          "type": "number",
          "description": "Minimum normalized similarity (0-1) required to count the answer as correct.",
          "minimum": 0,
          "maximum": 1,
          "default": 0.8
        },
        "case_sensitive": {
          "type": "boolean",
          "default": false
        }
      }
    }
  }
}
